{
  "dataset": "funding_origins",
  "as_of": "2026-03-20",
  "version": 1,
  "records": [
    {
      "funding_source_id": "nouns-bootstrap-2022",
      "title": "Gnars x Nouns Athletes",
      "source_kind": "nouns-governance-grant",
      "status": "approved",
      "requested_amount": {
        "currency": "ETH",
        "amount": 69.0,
        "usd_estimate_hint": 225000.0
      },
      "recipient": {
        "label": "shred.gnars.eth",
        "address": "0x0658f4ed17289144717713adffc2539ef7c2ef8e"
      },
      "proposal_chain": [
        {
          "stage": "approved",
          "platform": "nouns-agora",
          "proposal_ref": "51",
          "proposed_at": "2022-04-08",
          "status": "passed",
          "url": "https://nounsagora.com/proposals/51",
          "summary": "Original bootstrap funding request for Gnars treasury and operations.",
          "governance": {
            "for_votes": 63,
            "against_votes": 0,
            "abstain_votes": 2,
            "quorum": 26
          }
        }
      ],
      "tags": [
        "origin-funding",
        "bootstrap",
        "nouns-dao",
        "treasury-inflow",
        "metrics",
        "data-driven",
        "analytics",
        "governance",
        "treasury"
      ],
      "notes": "First major external treasury source used to bootstrap Gnars as a Nouns-aligned sub-DAO."
    },
    {
      "funding_source_id": "nouns-growth-2023-revision-track",
      "title": "Bring a million shredders onchain",
      "source_kind": "nouns-governance-grant",
      "status": "revision-track",
      "requested_amount": {
        "currency": "USDC",
        "amount": 300000.0
      },
      "recipient": {
        "label": "gnars.eth / shred.gnars.eth treasury path",
        "address": "0x0658f4ed17289144717713adffc2539ef7c2ef8e"
      },
      "proposal_chain": [
        {
          "stage": "original",
          "platform": "nouns-governance",
          "proposal_ref": "363",
          "proposed_at": "2023-09-07",
          "status": "superseded-by-revision",
          "url": "https://nouns.wtf/vote/363",
          "summary": "Original proposal before revision cycle.",
          "governance": {
            "for_votes": null,
            "against_votes": null,
            "abstain_votes": null,
            "quorum": null
          }
        },
        {
          "stage": "revised",
          "platform": "nouns-camp",
          "proposal_ref": "382",
          "proposed_at": "2023-09-22",
          "status": "voted",
          "url": "https://www.nouns.camp/proposals/382",
          "summary": "Revised version referencing proposal 363 and preserving the 300,000 USDC ask.",
          "governance": {
            "for_votes": 63,
            "against_votes": 20,
            "abstain_votes": 0,
            "quorum": 57
          }
        }
      ],
      "tags": [
        "origin-funding",
        "growth-funding",
        "nouns-dao",
        "proposal-revision",
        "metrics",
        "data-driven",
        "analytics",
        "governance",
        "treasury"
      ],
      "notes": "Treated as one funding source with two governance artifacts (original + revised)."
    }
  ]
}
